{
  "schema_version": "qeva-learning-concept/1",
  "id": "qeva:learning:nonlinearity",
  "revision": 1,
  "concept_ref": "qeva:1:nonlinearity@1",
  "title": "Nonlinearity",
  "difficulty": "developing",
  "prerequisites": [
    {
      "ref": "qeva:learning:recurrence@1",
      "minimum_state": "understood",
      "reason": "This route studies input-output rules before their iterated behavior."
    }
  ],
  "related": [
    "qeva:1:sensitivity@1",
    "qeva:1:optimization@1"
  ],
  "explanation": {
    "intuition": "Combining the inputs need not combine their effects.",
    "manipulation": "Calculate f(1 + 1) and f(1) + f(1) separately for f(x) = x².",
    "pattern": "The two outputs differ: 4 is not 2. Superposition fails in this example.",
    "mechanism": "Linearity is a universal requirement across inputs and scalars. One valid counterexample is enough to establish failure of that requirement.",
    "vocabulary": [
      {
        "term": "superposition",
        "meaning": "Compatibility with adding inputs and multiplying them by scalars."
      },
      {
        "term": "nonlinear",
        "meaning": "Not satisfying the stated linearity condition."
      }
    ],
    "notation": [
      {
        "symbol": "f(ax + by) = af(x) + bf(y)",
        "meaning": "The linearity requirement for every permitted choice."
      }
    ],
    "formal": {
      "source_ref": "qeva:1:nonlinearity@1",
      "text": "A map f:V→W is linear iff f(ax+by)=af(x)+bf(y) for all x,y and scalars a,b. It is nonlinear if this condition fails.",
      "context": "linear algebra",
      "caveat": "Nonlinearity alone does not imply complexity, instability, or chaos."
    },
    "proof": {
      "label": "worked-example",
      "statement": "The map f(x) = x² from ℝ to ℝ is nonlinear.",
      "steps": [
        "Take inputs x = y = 1 and scalars a = b = 1.",
        "Then f(x + y) = 4, but f(x) + f(y) = 2.",
        "Since 4 ≠ 2, the universal linearity condition fails."
      ],
      "limitation": "This counterexample does not imply instability, complexity, or chaos."
    },
    "frontier": "Which parameter choices change an iterated nonlinear rule’s behavior?"
  },
  "activities": [
    "qeva:activity:nonlinearity-counterexample@1",
    "qeva:activity:nonlinearity-scope@1"
  ],
  "mastery": {
    "understood": [
      "qeva:activity:nonlinearity-counterexample@1"
    ],
    "mastered": [
      "qeva:activity:nonlinearity-scope@1"
    ]
  },
  "provenance": {
    "kind": "editorial-learning-overlay",
    "source_refs": [
      "qeva:1:nonlinearity@1"
    ],
    "created": "2026-09-09",
    "license": "CC0-1.0",
    "review_status": "draft-for-mathematical-review"
  }
}
