{
  "schema_version": "qeva-learning-concept/1",
  "id": "qeva:learning:collatz-map",
  "revision": 1,
  "concept_ref": "qeva:1:collatz-map@1",
  "title": "Collatz map",
  "difficulty": "developing",
  "prerequisites": [
    {
      "ref": "qeva:learning:recurrence@1",
      "minimum_state": "understood",
      "reason": "An orbit is generated by repeatedly applying the update."
    },
    {
      "ref": "qeva:learning:parity@1",
      "minimum_state": "understood",
      "reason": "Parity selects the even or odd branch."
    }
  ],
  "related": [
    "qeva:1:periodicity@1",
    "qeva:1:collatz-conjecture@1"
  ],
  "explanation": {
    "intuition": "One machine, two branches: halve an even integer, or triple an odd integer and add one.",
    "manipulation": "Choose a positive start and an iteration budget. Use exact integer arithmetic and retain the stopping reason.",
    "pattern": "Some steps rise and others fall. The orbit from 6 reaches 1 after eight updates.",
    "mechanism": "The state is a positive integer. Its parity uniquely selects one of two arithmetic updates. A stopping budget belongs to the computation, not the mathematical map.",
    "vocabulary": [
      {
        "term": "piecewise rule",
        "meaning": "A rule whose branch depends on a stated condition."
      },
      {
        "term": "iteration budget",
        "meaning": "A bound on the work a run is allowed to perform."
      }
    ],
    "notation": [
      {
        "symbol": "T(n)",
        "meaning": "One Collatz update, not the entire orbit."
      },
      {
        "symbol": "Tᵏ(n)",
        "meaning": "k successive applications of T."
      }
    ],
    "formal": {
      "source_ref": "qeva:1:collatz-map@1",
      "text": "T(n)=n/2 if n is even, and T(n)=3n+1 if n is odd, for n∈N_{>0}. The orbit is n,T(n),T^2(n),....",
      "context": "positive integers",
      "caveat": "The map is deterministic and discrete, but calling it chaotic requires a separate precise definition and proof."
    },
    "proof": {
      "label": "worked-example",
      "statement": "The odd branch sends an odd integer to an even integer.",
      "steps": [
        "Write an odd input as n = 2k + 1 with integer k.",
        "Compute 3n + 1 = 6k + 4 = 2(3k + 2).",
        "The witness 3k + 2 is an integer, so the output is even."
      ],
      "limitation": "This local parity fact does not prove that every positive orbit reaches 1."
    },
    "frontier": "Separate a checked orbit, an eventual cycle, and a universal conjecture."
  },
  "activities": [
    "qeva:activity:collatz-step@1",
    "qeva:activity:collatz-run@1",
    "qeva:activity:collatz-even-proof@1"
  ],
  "mastery": {
    "understood": [
      "qeva:activity:collatz-step@1",
      "qeva:activity:collatz-run@1"
    ],
    "mastered": [
      "qeva:activity:collatz-even-proof@1"
    ]
  },
  "provenance": {
    "kind": "editorial-learning-overlay",
    "source_refs": [
      "qeva:1:collatz-map@1"
    ],
    "created": "2026-09-09",
    "license": "CC0-1.0",
    "review_status": "draft-for-mathematical-review"
  }
}
